{
    "version": "1.0.0",
    "summary": "helpful summary of your project, less than 80 characters",
    "repository": "https://github.com/user/project.git",
    "license": "BSD3",
    "source-directories": [
        "."
    ],
    "exposed-modules": [],
    "dependencies": {
        "elm-lang/core": "5.1.1 <= v < 6.0.0",
        "elm-lang/html": "2.0.0 <= v < 3.0.0"
    },
    "elm-version": "0.18.0 <= v < 0.19.0"
}